0,1,2,3,4,5
,,,,หน้า 7/1.1521,
ลำดับที,เลขที่บัตร,ชือ-สกุล,ชื่อสังกัด,ผลการลงคะแนน,
191,382,พลเอก สมชาย วิษณุวงศ์,พรรคพลังประชารัฐ,เห็นด้วย,
192,384,นายสมบัติ อำนาคะ,พรรคพลังประชารัฐ,เห็นด้วย,
193,386,นายสมพงษ์ โสภณ,พรรคพลังประชารัฐ,เห็นด้วย,
194,395,นายสรวุฒิ เนืองจำนงค์,พรรคพลังประชารัฐ,เท็นด้วย,
195,402,นายสัญญา นิลสุพรรณ,พรรคพลังประชารัฐ,เห็นด้วย,
196,403,นายสัณหพจน์ สุขศรี.มือง,พรรคพลังประชารัฐ,เห็นด้วย,
197,404,นายสุรพร ดนัยตั้งตระกูล,พรรคพลังประชารัฐ,เห็นด้วย,
198,407,นายสัมฤทธิ์ แทนทรัพย์,พรรคพลังประชารัฐ,เห็นด้วย,
199,411,นายสาธิต  อุยตระกูล,พรรคพลังประชารัฐ,.ห็นด้วย,
200,412,นายสายัณห์ ยุติธรรม,พรรคพลังประชารัฐ,เท็นด้วย,
201,423,นายสุชาติ อุสาหะ,พรรคพลังประชารัฐ,เท็นด้วย,
202,426,นายสุทา ประทิปฺณ ถลาง,พรรคพลังประชารัฐ,เห็นด้วย,
203,430,นายชวน ชูจันทร์,พรรคพลังประชารัฐ,เห็นด้วย,
204,436,นายสุรชาติ ศรีบุศกร,พรรคพลังประชารัฐ,เห็นด้วย,
205,442,นายสุรศักดิ์ ชิงนวรรณ์,พรรคพลังประชารัฐ,เท็นด้วย,
206,444,นายสุรศักดิ์ อนรรมพันธ์,พรรคพลังประชารัฐ,เห็นด้วย,
207,445,นายสุรสิทธิ์ นิธิวุฒิวรรักษ์,พรรคพลังประชารัฐ,เท็นด้วย,
208,446,นายสุรสิทธิ์ วงศ์วิทยานันท์,พรรคพลังประชารัฐ,เห็นด้วย,
209,448,นายสุริยะ  จึงรุ่งเรืองกิจ,พรรคพลังประชารัฐ,เห็นด้วย,
210,456,นายอธิรัฐ รัตนเศรษฐ,พรรคพลังประชารัฐ,เห็นด้วย,
211,457,นายอนันต์ ผลอำนวย,พรรคพลังประชารัฐ,เห็นด้วย,
212,461,นายอนุชา นาคาศัย,พรรคพลังประชารัฐ,เท็นด้วย,
213,476,นายอรรถาร ศีรีลัทธยากร,พรรคพลังประชารัฐ,.ห็นด้วย,
214,477,ร้อยตำรวจเอก อรุณ สวัสดี,พรรคพลังประชารัฐ,เท็นด้วย,
215,479,นายอัครวัฒน์ อัศวเหม,พรรคพลังประชารัฐ,เท็นด้าย,
216,480,นายอัฏฐพล โพธิพิพิธ,พรรคพลังประชารัฐ,เห็นด้วย,
217,485,"นายอาดีลัน อาลีอิส,ฮาะ",พรรคพลังประชารัฐ,เห็นด้วย,
218,499,นายเอี่ยม  ทองใจสด,พรรคพลังประชารัฐ,เท็นด้วย,
219,317,นายวัชระ ยาวอหะขัน,พรรคพลังประชารัฐ,ไม่เห็นด้วย,
,,,ง,,
220,406,นายสัมพันธ์ มะยูโช๊ะ,พรรคพลังประชารัฐ,ไม่เท็นด้วย,
221,460,นายอนุขา น้อยวงศ์,พรรคพลังประชารัฐ,ไมเห็นด้วย,
222,227,นายพงศึกวิน  จึงรุ่งเรืองกิจ,พรรคพลังประชารัฐ,=,
223,229,นายพยม พรหมเพชร ..,พรรคพลังประชารัฐ,อ,
,,,,หน้า 8/ 1.1521,
ลำดับที่,เลขที่บัตร,ชื่อ-สกุล,ชื่อสังกัด,ผลการลงคะแนน,
224,284,นายมานัส อ่อนอ้าย,พรรคพลังประชารัฐ,..,
225,389,นายสมศักดิ์  เทพสุทิน,พรรคพลังประชารัฐ,.๒.,
226,405,นายสันติ พร้อมพัฒน์,พรรคพลังประชารัฐ,4.,
227,420,นายสุชาติ ชมกลิน,พรรคพลังประชารัฐ,..,
228,421,นายสุขาติ ตันเจริญ,พรรคพลังประชารัฐ,..,
229, 006,นายกรวีร์ ปริศนานันทกุล,พรรคภูมิใจไทย,เห็นด้วย,
230,008,นายกฤติเดช สันติวชิระกุล,พรรคภูมิใจไทย,เห็นด้วย,
231,021,นายกิตติชัย เรืองสวัสดิ์,พรรคภูมิใจไทย,เห็นด้วย,
232,032,นายเกียรติ เหลืองขจรวิทย์,พรรคภูมีใจไทย,เห็นด้วย,
233,033,นายเกื้อกูล ด่านขัยวิจิตร,พรรคภูมิใจไทย,เห็นด้วย,
234,040,นายคงกฤษ ฉัตรมาลีรัตน์,พรรคภูมิใจไทย,เห็นด้วย,
235,052,นายจักรกฤษณ์ ทองศรี,พรรคภูมีใจไทย,เท็นด้วย,
236,082,นายขยุต ภุมมะกาญจนะ,พรรคภูมิใจไทย,เห็นด้าย,
237,095,นายขาดา ไทยเศรษฐ์,พรรคภูมิใจไทย,เท็นด้าย,
238,104,นายโขติพิพัฒน์ .ตชะโสภณมณี,พรรคภูมีใจไทย,.ท็นด้วย,
239,113,นายริตินันท์ แ.สงนาค,พรรคภูมีใจไทย,เห็นด้วย,
240,116,นายณัฏฐ์ชนน ศรีก่อ.กื้อ,พรรคภูมิใจไทย,เห็นด้วย,
241,132,นายไตรเทพ งามกมล,พรรคภูมิใจไทย,เห็นด้วย,
242,136,พันเอกเศรษฐพงค์ มะลิสุวรรณ,พรรคภูมิใจไทย,เห็นด้วย,
243,177,นายสุชาติ โชคชัยวัฒนากร,พรรคภูมีใจไทย,เห็นด้วย,
244,197,นายบุญลือ ประเสริฐโสภา,พรรคภูมีใจไทย,เห็นด้วย,
245,200,นายปกรณ์ มุ่งเจริญพร,พรรคภูมิใจไทย,เห็นด้วย,
246,230,นายพรชัย อำนวยทรัพย์,พรรคภูมิใจไทย,เห็นด้าย,
247,233,นางสาวพรพิมล ธรรมสาร,พรรคภูมิใจไทย,เห็นด้วย,
248,246,นายพิบูลย์ รัชกิจประการ,พรรคภูมิใจไทย,เห็นด้วย,
249,249,นายพิษณุ พลธี,พรรคภูมิใจไทย,เห็นด้วย,
250,263,นายาราคร ปริศนานันทกุล,พรรคภูมิใจไทย,เท็นด้วย,
251,274,ร้อยตำราจตรีมณฑล โพธิ์คาย,พรรคภูมีใจไทย,เห็นด้วย,
252,280,นางสาวมัลลิกา จิระพันธุ์วาณิข,พรรคภูมิใจไทย,เห็นด้วย,
253,281,นายมานท ศรีผึ้ง,พรรคภูมิใจไทย,เห็นด้วย,
254,299,นายรังสิกร ทิมาตฤกะ,พรรคภูมิใจไทย,เห็นด้าย,
255,303,นายรุ่งโรจน์ ทองศรี,พรรคภูมิใจไทย,เท็นด้วย,
256,330,นายวิรัช พันธุมะผล .า,พรรคภูมิใจไทย,เท็นด้วย,
,,,,หน้า 9/ 1.1521,
ลำดับที่,เลขที่บัตร,ชื่อ-สกุล,ชื่อสังกัด,ผลการลงคะแบน,
257,333,นายวิสิทธิ์ พิทยาภรณ์,พรรคภูมิใจไทย,เห็นด้วย,
258,341,นายมารุต มัสยวาณิช,พรรคภูมิใจไทย,เท็นด้วย,
259,353,นางสาวศรีนวล บุญลือ,พรรคภูมิใจไทย,เท็นด้วย,
260,364,นายศิริวัฒน์ ขจรประศาสน์,พรรคภูมิใจไทย,เท็นด้วย,
261,369,นางสาวศุภมาส อิศรภักดี,พรรคภูมีใจไทย,เห็นด้วย,
262,373,นายสนอง เทพอักษรณรงค์,พรรคภูมิใจไทย,เห็นด้วย,
263,385,นายสมบูรณํ ชารัมย์,พรรคภูมิใจไทย,เห็นด้วย,
264,396,นายสรอรรถ กลินประทุม,พรรคภูมิใจไทย,เท็นด้วย,
265,399,นายสฤษฎ์พงษ์ เกี่ยวข้อง,พรรคภูมิใจไทย,เห็นด้วย,
266, 400,นายสฤษดิ์ บุตรเนียร,พรรคภูมิใจไทย,เท็นด้วย,
267,419,นายสิริพงศ์ อังคสกุลเกียรติ,พรรคภูมิใจไทย,เท็นด้วย,
268,443,นายสุรศักดิ์ พันธ์เจริญวรกุล,พรรคภูมิใจไทย,เท็นด้วย,
269,451,นายโสภณ ชารัมย์,พรรคภูมิใจไทย,เห็นด้วย,
270,455,นายอดิพงษ์ ริติพิทยา,พรรคภูมีใจไทย,เห็นด้วย,
271,459,นายอนาวิล รัตนสถาพร,พรรคภูมิใจไทย,เท็นด้วย,
272,471,นายอภิชา เลิศพชรามล,พรรคภูมีใจไทย,เท็นด้วย,
273,494,นายเอกการ ชื่อทรงธรรม,พรรคภูมิใจไทย,เท็นด้าวย,
274,488,นายอาสพลธ์ สรรณํไตรภพ,พรรคภูมิใจไทย,ไม่เท็นด้วย,
275,088,นายสวาป เผ่าประทาน,พรรคภูมิใจไทย, งดออก.สียง,
276,256,นางสาวเพชรดาว โต๊ะมีนา,พรรคภูมใจไทย,งดออกเสียง,
277,366,นายศุภชัย ใจสมุทร,พรรคภูมิใจไทย,งดออก.สียง,
278,482,นายอับดุลบาซิม อาบู,พรรคภูมีใจไทย,งดออกเสียง,
279,379,นายสมเจตน์ ลิมปะพันธุ์,พรรคภูมิใจไทย,ไม่ลงคะแนนเสียง,
280,078,นายเจ.เศรษฐ์ ไทยเศรษฐ์,พรรคภูมิใจไทย . .,.,
281,153,นายธนยศ ทิมสุวรรณ,พรรคภูมิใจไทย,ต.,
282,291,นายยศวัฒน์ มาไพศาลสิน,พรรคภูมิใจไทย,.,
283,313,นายวรศิษฎ์ เลียงประสิทธิ์,พรรคภูมิใจไทย,..,
284,358,นายศักดิ์สยาม ชิดชอบ,พรรคภูมิใจไทย,.,
285,368,นายศุภขัย โพธิ์สุ,พรรคภูมิใจไทย,.,
286,463,นายอนุทิน ชาญวีรกูล,พรรคภูมิใจไทย,อา.,
287,489,นายอำนาจ  วิลาวัลย์,พรรคภูมิใจไทย,..,
288,030,นายเกษมสันต์ มีทิพย์,พรรคก้าวไกล,เท็นด้วย,
289,038,นายขวัญเลิศ พานิชมาท,พรรคก้าวไกล,เท็นด้วย,
,,,,หน้า 10/1.1521,
ลำดับที่,เลขทีบัตร,ชื่อ-สกุล,ชื่อสังกัด,ผลการลงคะแนบ,
290,250,นายพีรเดช คำสมุทร,พรรคก้าวไกล,เห็นด้วย,
291,475,นางอมรัตน์ โชคปมิตต์กุล,พรรคก้าวไกล,เห็นด้วย,
292,497,นายเอกภพ เพียรพิเศษ,พรรคก้าวไกล,เท็นด้วย,
293,013,นายกัญจน์พงศ์ จงสุทธนามณี,พรรคก้าวไกล,ไม่.เท็นด้วย,
294,045,นายคำพอง  เทพาคำ,ทรรคก้าวไกล,ไม่เห็นด้วย,
295,048,นายจรัส  คุ้มไข่น้ำ,พรรคก้าวไกล,ไม่เท็นด้วย,
296,065,นายจิรวัฒน์ อรัณยกานนท์,พรรคก้าวไกล,ไม่เท็นด้วย,
297,066,นายจิรัฏฐ์ ทองสุวรรณ์,พรรคก้าวไกล,ไมเท็นด้วย,
298,085,พันตำราจตรี ชวลิต เลาทอุดมพันธ์,พรรคก้าวไกล,ไมเห็นด้วย,
299,109,นางสาาญาณธิชา บัวเผือน`,พรรคก้าวไกล,ไม่เท็นด้วย,
300,15,นางสาวณธีภัสร์ กุลเศรษฐสิทธิ์,พรรคก้าวไกล,ไม่เท็นด้วย,
301,119,นายณัฐชา บุญไชยอินสาัสดิ์,พรรคก้าวไกล,ไม่เท็นด้วย,
302,120,นายณัฐพงษ์ เรืองปัญญาวุฒิ,พรรคภ้าวไกล,ไม่เท็นด้วย,
303,122,นายณัฐพล สืบศักดิ์วงศ์,พรรคก้าวไกล,ไม่เห็นด้วย,
304,124,นายณัฐวุฒิ บัวประทุม,พรรคก้าวไกล,ไม่เท็นด้วย,
305,138,นายทวีศักดิ์  ทักษิณ,พรรคก้าวไกล,ไม่เท็นด้วย,
306,139,นายทศพร ทองศิริ,พรรคก้าวไกล,ไม่เท็นด้วย,
307,140,นายทองแดง เบ็ญจะปัก,พรรคก้าวไกล,ไม่เท็นด้วย,
308,148,นายเท่าพิภพ ลิ้มจิตรกร,พรรคก้าวไกล,ไมเห็นด้วย,
309,156,นายมานพ คีรีภูวดล,พรรคก้าวไกล,ไม่เห็นด้วย,
310,160,นายธัญวัจน์ กมลวงศ์วัฒน์,พรรคก้าวไกล,ไมเห็นด้วย,
311,166,นายธีรัจชัย พันธุมาศ,พรรคก้าวไกล,ไม่เห็นด้วย,
312,180,นายนิติพล ผิวเหมาะ,พรรคก้าวไกล,ไม่เท็นด้วย `,
313,199,นางสาว.บญจา แสงจันทร์,พรรคก้าวไกล .,ไม่เท็นด้วย,
314,201,นายปกรณวุฒิ  อุดมพิพัฒน์สกุล,พรรคก้าวไกล,ไม่เห็นด้าย,
315,203,นายปดิพัทธ์ สันติภาดา,พรรคก้าวไกล,ไมเห็นด้วย,
316,215,นายประเสริฐพงษ์ ศรนุวัตร์,พรรคก้าวไกล,ไม่เท็นด้วย,
317,216,นายปริญญา ช่วยเกตฺ คีรีรัตน์,พรรคก้าวไกล,ไม่เท็นด้วย,
318,241,นายพิจารณ์ เชาวพัฒนวงศ์,พรรคก้าวไกล,ไมเห็นด้วย,
319,245,นายพิธา ลิ้มเจริญรัตน์,พรรคก้าวไกล,ไม่เห็นด้วย,
320,300,นายรังสิมันต์ โรม,พรรคก้าวไกล,ไม่เท็นด้วย,
321,310,นายารภพ วิริยะโรจน์,พรรคก้าวไกล,ไม่เท็นด้วย,
322,311,นางสาววรรณวรี ตะล่อมสิน,พรรคก้าวไกล,ไม่เห็นด้าย,
,,,,หน้า 11/1.1521,
ลำดับที่,เลขที่บัตร,ชื่อ-สกุล,ชื่อสังกัด,ผลการลงคะแนน,
323,312,นางสาววรรณวิภา ไม้สน,พรรคก้าวไกล,ไมเห็นด้วย,
324,326,นายวาโย อัศวรุ่งเรือง,พรรคก้าวไกล,ไมเห็นด้วย,
325,347,นายวุฒินันท์ บุญชู,พรรคก้าวไกล,ไม่เห็นด้วย,
326,357,นายศักดินัย นุ่มหนู,พรรคก้าวไกล,ไม่เท็นด้วย,
327,361,นางสาวศิริกัญญา ตันสกุล,พรรคก้าวไกล,ไม่เห็นด้วย,
328,374,นายสมเกียรติ ไชยวิสุทธิกุล,พรรคก้าวไกล,ไม่เห็นด้วย,
329,375,นายสมเกียรติ ถนอมสินธุ์,พรรคก้าวไกล,ไม่เห็นด้วย,
330,381,นายสมขาย ฝังชลจิตร,พรรคก้าวไกล,ไมเห็นด้วย,
331,425,นางสาวสุทธวรรณ  สุบรรณฺณ อยุธยา,พรรคก้าวไกล,ไม่เท็นด้วย,
332,428,นายสุเทพ  อู่อัน,พรรคก้าวไกล,ไม่เท็นด้วย,
333,431,พลตำราจตรีสุพิศาล ภักดืนฤนาถ,พรรคก้าวไกล,ไม่เท็นด้วย,
334,437,นายสุรเชษฐ์ ประวีณวงศ์วุฒิ,พรรคก้าวไกล,ไม่เห็นด้วย,
335,440,รองศาสตราจารย์สุรวาท ทองบุ,พรรคก้าวไกล,ไม่เห็นด้วย,
336,452,นายองค์การ ขัยบุตร,พรรคก้าวไกล,ไม่เท็นด้วย,
337,473,นายอภิชาติ ศิริสุนทร,พรรคก้าวไกล,ไม่เห็นด้วย,
338,04^,นายคารม พลพรกลาง,พรรคก้าวไกล,=,
339,.002,ศาสตราจารย์กนก วงษ์ตระหง่าน,พรรคประชาธิปัตย์,เห็นด้วย,
340,016,นายพิสิฐ ลี้อาธรรม,พรรคประชาริปัตย์,เห็นด้วย,
341,031,นายเกียรติ สิทธือมร,พรรคประชาธิปัตย์,เห็นค้วย,
342,061,นางสาวจิตภัสร์ ตั้น กฤดากร,พรรคประชาธิปัตย์,เห็นด้วย,
343,071,นายอิสระ เสรีวัฒนวุฒิ,พรรคประชาธิปัตย์,เห็นด้วย,
344,073,นายจุรินทร์ ลักษณวิศิษฎ์,พรรคประชาธิปัตย์,เห็นด้วย,
345,093,นายชัยวุฒิ บรรณวัฒน์,พรรคประชาธิบัตย์,เท็นด้วย,
346,097,นายชินวรณ์ บุณยเกียรติ,พรรคประชาธิปัตย์,เห็นด้วย,
347,129,นายเดขอิศม์ ขาวทอง,พรรคประชาธิปัตย์,เห็นด้วย,
348,134,นางสาวสุภาพร กำเนิดผล,พรรคประชาธิบัตย์,เท็นด้วย,
349,147,นายเทอดพงษ์ไชยนันทน์,พรรคประชาธิปัตย์,เท็นด้วย,
350,161,นายธารา ปีตุเตชะ,พรรคประชาธิปัตย์,เท็นด้วย,
351,173,นายนริศ ขำนุรักษ์,พรรคประชาธิปัตย์,เห็นด้วย,
352,189,นางสาวแนน บุณย์ธิดา สมขัย,พรรคประชาธิปัตย์ .,เห็นด้วย,
353,190,นายบัญญัติ เจตนจันทร์,พรรคประชาธิปัตย์,เท็นด้วย,
354,191,นายบัญญัติ บรรทัดฐาน,พรรคประชาธิปัตย์,เห็นด้วย,
355,204,นายประกอบ  รัตนพันธ์,พรรคประชาธิปัตย์,เท็นด้วย,
,,4,,,
,,,,หน้า 12/1 1521,
ลำดับที่,เลขทีบัตร,ชือ-สกุล,ชื่อสังกัด,ผลการลงคะแนน,
356,209,นายประมาล พงศ์ถาวราเดช,พรรคประชาธิปัตย์,เห็นด้วย,
357,248,นางสาวพิมพ์ภัทรา วิชัยกุล,พรรคประชาธิปัตย์,เห็นด้วย,
358,251,นางสาวพิมพรพี พันธุ์วิชาติกุล,พรรคประชาธิปัตย์,เห็นด้าย,
359,268,นายภานุ ศรีบุศยกาญจน์,พรรคประชาธิปัตย์,เห็นด้าย,
360,277,นายมนตรี ป่าน้อยนนท์,พรรคประชาธิปัตย์,เท็นด้วย,
361,301,นางสาวรังสิมา รอดรัศมี,พรรคประชาธิปัตย์,เท็นด้วย,
362,308,นางสาววชิรากรณ์ กาญจนะ,พรรคประชาธิปัตย์,เห็นด้วย,
363,334,นายวิวรรธน์ นิลวัชรมณี,พรรคประชาธิปัตย์,เห็นด้วย,
364,348,นายวุฒิพงษ์ นามบุตร,พรรคประชาธิปัตย์,เห็นด้วย,
365,355,นางศรีสมร รัศมีฤกษ์เศรษฐ์,พรรคประชาธิปัตย์,เท็นด้าย,
366,363,นางศิริวรรณ ปราศจากศัตรู,พรรคประชาธิปัตย์,เท็นด้วย,
367,380,นายสมชาติ ประดิษฐพร,พรรคประชาธิปัตย์,เท็นด้วย,
368,398,นายสราวุธ อ่อนละมัย,พรรคประชาธิปัตย์,เท็นด้วย,
369,408,นายสาคร  เกียวข้อง,พรรคประชาธิปัตย์,เห็นด้วย,
370,409,นายสาทิตย์ วงศ์หนองเตย,พรรคประชาธิปัตย์,เท็นด้วย,
