0,1,2,3,4,5
371,415,พันโทสินธพ แก้วพิจิตร,พรรคประชาธิปัตย์,เท็นด้าย,
372,.416,นายสินิตย์ เลิศไกร,พรรคประชาธิปัตย์,เท็นด้วย,
373,424,นางสาวสุณัฐขา โล่สถาพรพิพิธ,พรรคประชาธิปัตย์,เห็นด้วย,
374,453,นายองอาจ คล้ามไพบูลย์,พรรคประชาธิปัตย์,เห็นด้วย,
375,474,นายสุทัศน์ เง็นหมืน,พรรคประชาธิบัตย์,เห็นด้วย,
376,478,นายอัครเดช วงษ์พิทักษ์โรจน์,พรรคประขาธิปัตย์,เห็นด้วย,
377,228,นายพนิต วิกิตเศรษฐ์,พรรคประชาธิปัตย์,ไม่เท็นด้วย,
378,084,นายชวน หลีาภัย,พรรคประชาธิปัตย์, งดออกเสียง,
379,447,พลตำรวจตรีสุรินทร์ ปาลา.ร่,พรรคประชาธิปัตย์, งดออก.สียง,
380,014,นางกันตวรรณ ตันเกียร,พรรคประชาธิบัตย์,.-,
381,089,นายขัยชนะ เดชเดโข,พรรคประชาธิปัตย์,..,
382,162,นายธิรภัทร พริ้งศุลกะ,พรรคประชาธิปัตย์,.,
383,343,นายวีระชัย วีระเมธีกุล,พรรคประชาธิปัตย์,.,
384,410,นายสาธิต ปิตุเตชะ,พรรคประชาธิปัตย์,=,
385,470,นายอภิชัย เตขะอุบล,พรรคประชาธิปัตย์ .,=,
386,481,นายอันวาร์ สา.ละ,พรรคประชาธิปัตย์,.,
387,484,นายอัศวิน วิภูศิริ,พรรคประชาธิปัตย์,..,
388,492,นายจักพันธ์ ปียพรไพบูลย์ .,พรรคประชาธิปัตย์,อ,
,,,,หน้า 13/1.1521,
ลำดับที่,เลขที่บัตร,ชื่อ-สกุล,ชื่อสังกัด,ผลการลงคะแนน,
389,028,นาย'กษม ศุภรานนท์,พรรคเศรษฐกิจไทย,เห็นด้วย,
390,051,นางสาวจอมขวัญ กลับบ้านเกาะ,"พรรค,ศรษฐกิจไทย",เท็นด้วย,
391,117,นายณัฏฐพล จรัสรพีพงษ์,พรรค.ศรษฐกิจไทย,เท็นด้าย,
392,118,นายยุทธนา โพธสุธน,พรรคเศรษฐกิจไทย,.ท็นด้วย,
393,154,นายธนะสิทธิ  โควสุรัตน์,พรรคเศรษฐกิจไทย,เท็นด้าย,
394,155,นายธนัสภ์ ทวีเกื้อกูลกิจ,พรรคเศรษฐกิจไทย,เห็นด้วย,
395,219,นายบัญญา จีนาคำ,พรรคเศรษฐกิจไทย,เห็นด้วย,
396,225,นายไผ่ ลึกค์,พรรคเศรษฐกิจไทย,เห็นด้วย,
397,231,ผู้ช่วยศาสตราจารย์พรชัย อินทร์สุข,พรรคเศรษฐกิจไทย, เท็นด้วย,
398,265,นายภาคภูมิ บูลยประมุข,พรรคเศรษฐกิจไทย,เท็นด้าย,
399,288,พลตำราจเอก ยงยุทธ เทพจำนงค์,พรรคเศรษฐกิจไทย,.ท็นด้าย,
4ด0, 401,นายสะกิระ เผือกประพันธุ์,พรรคเศรษฐกิจไทย,.ห็นด้วย,
401,175,นายสมศักดิ์ คุณเงิน,พรรคเศรษฐกิจไทย, งดออกเสียง,
402,069,นายจีรเดช ศรีวิราช,พรรค.ศรษฐกิจไทย,=,
403,157,นายธรรมนัส พรหมะผ่า,พรรคเศรษฐกิจไทย,.,
404,198,นายบุญสิงท์ วรินทร์รักษ์,พรรคเศรษฐกิจไทย,.,
405,.072,นายเผดิมชัย สะสมทรัพย์,พรรคขาติไทยพัฒนา,.ท็นด้วย,
406,074,นายจุลพันธ์ โนนศรีชัย,พรรคชาติไทยพัฒนา,เห็นด้าย,
407,125,นายณัฐวุฒิ ประ.สริฐสุวรรณ,พรรคชาติไทยพัฒนา,เห็นด้วย,
408,165,นายธีระ วงศ์สมุทร,พรรคชาติไทยพัฒนา,เท็นด้วย,
409,170,นายนพดล  มาตรศรี,พรรคชาติไทยพัฒนา,เท็นด้วย,
410,178,นายนิกร  จำนง,พรรคชาติไทยพัฒนา,.ท็นด้วย,
411,240,นายพาณุวัฒณ์ สะสมทรัพย์,พรรคชาติไทยพัฒนา,เท็นด้วย,
412,315,นายาราวุธ ศิลปอาชา,พรรคชาติไทยพัฒนา,เห็นด้าย,
413,394,นายสรชัด สุจิตต์,พรรคชาติไทยพัฒนา,เห็นด้วย,
414,449,นายเสมอก้น เที่ยงธรรม,พรรคชาติไทยพัฒนา,เท็นด้วย,
415,465,นายอนุรักษ์ จุรีมาศ,พรรคชาติไทยพัฒนา,.ท็นด้าย,
416,207,นายประภัตร โพธสุธน,พรรคชาติไทยพัฒนา,อ,
417,210,นายประสงค์ บูรณ์พงศ์,พรรค.สรีรวมไหย,เห็นด้วย,
418,304,นายเรวัต วิศรุตเวช,พรรค.สรีรามไทย .,ไม่เท็นด้วย,
419,332,นายวิรัตน์ วรศสิริน,พรรคเสรีรามไทย,ไม่เท็นด้วย,
420,336,พลตำรวจโทวิศณุ ม่วง.พรสี,พรรคเสรีรวมไทย,ไม่เห็นด้วย,
421,450,พลตำรวจเอกเสรีพิศุทธ์ เตมียเวส า,พรรค.เสรีรวมไทย,ไม่เท็นด้วย,
,,,,หน้า 14/ 1.1521,
ลำดับที่,เลขทีบัตร,ชือ-สกุล,ชื่อสังกัด,ผลการลงคะแนน,
422,490,นายอำไพ กองมณี,พรรคเสรีรวมไทย,ไม่เท็นด้วย,
423,152,"นางสาวธนภร โสมทอง,.ดง",พรรค.สรีรวมไทย,..,
424,172,นางสาวนภาพร เพ็ชร์จินดา,พรรค.สรีรวมไทย,.-,
425,254,นายเพชร เอกกำลังกุล,พรรคเสรีรวมไทย,อ,
426,3!8,นายวัชรา ณวังขนาย,พรรคเสรีรวมไทย,.=,
427,464,นายอนุมัติ ชูสารอ,พรรคประชาชาติ,เห็นด้วย,
428,003,นายกมลศักดิ์ ลีวาเมาะ,พรรคประชาชาติ, งดออกเสียง,
429,026,นายกู.ฮง ยาวอหะชัน,พรรคประชาชาติ, งดออกเลียง,
430,108,นายชูการ์โน มะทา,พรรคประชาชาติ, งดออกเสียง,
431,388,นายสมมุติ เบ็ญจลักษณ์,พรรคประชาชาติ, งดออกเสียง,
432,483,นายอับดุลอายี สาแม็ง,พรรคประชาชาติ,งดออกเลียง,
433,325,พันตำรวจ.อก ทวี สอดสอง,พรรคประชาชาติ,-,
434,223,นางสาาปิยะรัฐชย์ ติยะไพรัช,พรรคเพื่อชาติ,ไม่เท็นด้วย,
435,257,นายเพชรวรรติ วัฒนพงศศิริกุล,พรรค.พื่อชาติ,...,
436,306,นางลินดา เชิดชัย,พรรค.เพือชาติ,.,
437,351,นายศรัณย์วุฒิ ศรัณย์เกตุ,พรรคเพื่อชาติ,..,
438,371,นายสงคราม กิจเลิศไพโรจน์,พรรคเพื่อชาติ,..,
439,487,นายอารี ไกรนรา,พรรคเพื่อชาติ,ะ,
440,269,นายภาสกร เงินเจริญกุล,พรรคเศรษฐกิจใหม่,เห็นด้วย,
441,279,นายมนูญ สิวาภิรมยรัตน์,พรรคเศรษฐกิจใหม่,.ท็นด้วย,
442,285,นางมารศรี ขจร.เรืองโรจน์,พรรคเศรษฐกิจใหม่,เท็นด้วย,
443,286,นายมิงขวัญ แสงสุวรรณ์,พรรคเศรษฐกิจใหม่,เห็นด้วย,
444,432,นายสุภดืช  อากาศฤกษ์,พรรคเศรษฐกิจใหม่,เห็นด้วย,
445,183,นายนิยม  วิวรรธนดิฐกุล,พรรคเศรษฐกิจใหม่,อ,
446,169,นายนพดล  แก้าสุพัฒน์,พรรคพลังท้องถินไท,เท็นด้วย,
447,011,นางสาวกวินนาถ ตาคีย์,พรรคพลังท้องถิ่นไท,ไม่เห็นด้วย,
448,034,ศาสตราจารย์โกวิทย์ ทวงงาม,พรรคพลังท้องถิ่นไท,ไมเห็นด้วย,
449,059,นายจารึก ศรีอ่อน,พรรคพลังท้องถิ่นไท,ไม่เท็นด้วย,
450,087,นายขัชวาลล์ คงอุดม,พรรคพลังท้องถิ่นไท,-,
451,255,นางสุเนตตา แชโก๊ะ,พรรครวมพลังประชาชาติไทย,เห็นด้วย,
452,469,นางสาวอนุสรี ทับสุวรรณ,พรรครวมพลังประชาชาติไทย,เห็นด้วย,
453,039,นายเขตรัฐ เหล่าธรรมทัศน์,พรรครวมพลังประชาชาติไทย,.,
454,057,นางสาวจุทาทัตต เหล่าธรรมทัศน์,พรรครามพลังประชาชาติไทย,ต.,
,,,,หน้า 15/ 1.1521,
ลำดับที,เลขที่บัตร,ชื่อ-สกุล,ชื่อสังกัด,ผลการลงคะแนน,
455,429,นายสุพล จุลใส,พรรครวมพลังประชาชาติไทย,.,
456,126,นายดล เหตระกูล,พรรคชาติพัฒนา,เท็นด้วย.,
457,146,นายเทวัญ ลิปตพัลลภ,พรรคชาติพัฒนา,เท็นด้วย,
458,316,นายวัชรพล โตมรศักดิ์,พรรคชาติพัฒนา,เท็นด้วย,
459,392,นายสมัคร ป้องวงษ์,พรรคชาติพัฒนา,เห็นด้วย.,
460,390,นายสมศักดิ์ พันธุ์เกษม,.-,เห็นด้วย,
461,319,นายวัฒนา ช่าง.หลา,ต.,อ,
462,498,นาย.อกราข ชางเหลา,=,..,
463,128,นายดำรงค์ พิเดซ,พรรครักษ์ผีนป่าประเทศไทย,ไม่เห็นด้วย,
464,290,นายยรรยงก์ ถนอมพิชัยธำรง,พรรครักษ์ผืนป่าประเทศไทย,.,
465,218,นายปรีดา บุญเพลิง,พรรคครูไหยเพื่อประชาชน,เท็นด้วย,
466,273,นายมงคลกิตติ๋ สุขสินธารานนท์,พรรคไทยศรีวิไลย์,ไม่เท็นด้วย,
467, 004,นายพีระวิทย์ .รืองลือดลภาค,พรรคไทรักธรรม,ไมเห็นด้วย,
468,438,นายสุรทิน พิจารณ์,พรรคประชาธิปไตยใหม่,ไม่เท็นด้วย,
469,377,นางนันทนา สงฆ์ประชา,พรรคประชาภิวัฒน์,เท็นด้วย,
470,365,นางสาวศิลัมพา เลิศนุวัฒน์,พรรคพลเมืองไทย,ไม่เห็นด้วย,
471,135,นางบุญญาพร นาตะธนภัทร,พรรคพลังชาติไทย,เห็นด้วย,
472,296,นายระวี มาศฉมาดล,พรรคพลังธรรมใหม่,เท็นด้วย,
473,179,นายนิคม บุญวิเศษ,พรรคพลังปวงชนไทย,.,
474,041,นายคทาเทพ เตชะเดช.เรืองกุล,พรรคเพือชาติไทย,เห็นด้วย,
 เครื่องหมาย,บ,(ยัติภังค์) หมายถึง ฺผู้ไม่ลงมติ/ผู้ลาประชุม/ผู้ขาดการประชุม,,,
,ยู้ปฏิบัติหน้าทีประธานในทีประชุม,,,,
นายขวน, หลีกภัย,ประธานสภาผู้แทนราษฎร,,,
,,,.,,
,,.,,,
